{
  "$schema": "../../../@freesail/catalogs/src/schemas/catalog-schema.json",
  "$id": "https://freesail.dev/catalogs/weather_catalog_v1.json",
  "title": "Weather Catalog",
  "description": "Weather-specific UI components for displaying forecasts, conditions, and alerts",
  "catalogId": "https://freesail.dev/catalogs/weather_catalog_v1.json",
  "components": {
    "WeatherCard": {
      "type": "object",
      "allOf": [
        {
          "$ref": "./common/common_types.json#/$defs/ComponentCommon"
        },
        {
          "$ref": "#/$defs/CatalogComponentCommon"
        },
        {
          "type": "object",
          "description": "A comprehensive weather summary card for a location. Key properties: location (required), temperature (required), condition (required, e.g. sunny/cloudy/rainy), unit (C/F, default C), humidity (0-100), windSpeed, windUnit (km/h/mph/m/s), feelsLike, background (CSS color override).",
          "properties": {
            "component": {
              "const": "WeatherCard"
            },
            "location": {
              "$ref": "./common/common_types.json#/$defs/DynamicString",
              "description": "City or location name (e.g. 'London', 'New York'). Extract this from the user's request."
            },
            "temperature": {
              "$ref": "./common/common_types.json#/$defs/DynamicNumber",
              "description": "Current temperature value"
            },
            "unit": {
              "type": "string",
              "description": "Temperature unit(C or F)",
              "enum": [
                "C",
                "F"
              ],
              "default": "C"
            },
            "condition": {
              "type": "string",
              "description": "Weather condition",
              "enum": [
                "sunny",
                "cloudy",
                "partly-cloudy",
                "rainy",
                "stormy",
                "snowy",
                "foggy",
                "windy"
              ]
            },
            "humidity": {
              "$ref": "./common/common_types.json#/$defs/DynamicNumber",
              "description": "Humidity percentage (0-100)"
            },
            "windSpeed": {
              "$ref": "./common/common_types.json#/$defs/DynamicNumber",
              "description": "Wind speed value"
            },
            "windUnit": {
              "type": "string",
              "description": "Wind speed unit",
              "enum": [
                "km/h",
                "mph",
                "m/s"
              ],
              "default": "km/h"
            },
            "feelsLike": {
              "$ref": "./common/common_types.json#/$defs/DynamicNumber",
              "description": "Feels-like temperature"
            },
            "background": {
              "$ref": "./common/common_types.json#/$defs/DynamicString",
              "description": "Background color override"
            }
          },
          "required": [
            "component",
            "location",
            "temperature",
            "condition"
          ]
        }
      ],
      "unevaluatedProperties": false
    },
    "ForecastRow": {
      "type": "object",
      "allOf": [
        {
          "$ref": "./common/common_types.json#/$defs/ComponentCommon"
        },
        {
          "$ref": "#/$defs/CatalogComponentCommon"
        },
        {
          "type": "object",
          "description": "A single row in a weather forecast, showing the day's conditions. Key properties: day (required, e.g. 'Mon', 'Today'), high (required), low (required), condition (required), unit (C/F, default C), precipitation (chance percentage 0-100).",
          "properties": {
            "component": {
              "const": "ForecastRow"
            },
            "day": {
              "$ref": "./common/common_types.json#/$defs/DynamicString",
              "description": "Day label (e.g. 'Mon', 'Tuesday', 'Today')"
            },
            "high": {
              "$ref": "./common/common_types.json#/$defs/DynamicNumber",
              "description": "High temperature"
            },
            "low": {
              "$ref": "./common/common_types.json#/$defs/DynamicNumber",
              "description": "Low temperature"
            },
            "unit": {
              "type": "string",
              "description": "Temperature unit",
              "enum": [
                "C",
                "F"
              ],
              "default": "C"
            },
            "condition": {
              "type": "string",
              "description": "Weather condition for the day",
              "enum": [
                "sunny",
                "cloudy",
                "partly-cloudy",
                "rainy",
                "stormy",
                "snowy",
                "foggy",
                "windy"
              ]
            },
            "precipitation": {
              "$ref": "./common/common_types.json#/$defs/DynamicNumber",
              "description": "Precipitation chance percentage (0-100)"
            }
          },
          "required": [
            "component",
            "day",
            "high",
            "low",
            "condition"
          ]
        }
      ],
      "unevaluatedProperties": false
    },
    "ForecastPanel": {
      "type": "object",
      "allOf": [
        {
          "$ref": "./common/common_types.json#/$defs/ComponentCommon"
        },
        {
          "$ref": "#/$defs/CatalogComponentCommon"
        },
        {
          "type": "object",
          "description": "A container panel that groups ForecastRow children into a titled forecast list. Key properties: children (required, array of ForecastRow IDs or a template), title (default 'Forecast').",
          "properties": {
            "component": {
              "const": "ForecastPanel"
            },
            "title": {
              "$ref": "./common/common_types.json#/$defs/DynamicString",
              "description": "Panel title (e.g. '5-Day Forecast')",
              "default": "Forecast"
            },
            "children": {
              "$ref": "./common/common_types.json#/$defs/ChildList",
              "description": "Defines the children. Use an array of strings for a fixed set of children, or a template object to generate children from a data list."
            }
          },
          "required": [
            "component",
            "children"
          ]
        }
      ],
      "unevaluatedProperties": false
    },
    "TemperatureDisplay": {
      "type": "object",
      "allOf": [
        {
          "$ref": "./common/common_types.json#/$defs/ComponentCommon"
        },
        {
          "$ref": "#/$defs/CatalogComponentCommon"
        },
        {
          "type": "object",
          "description": "Renders a temperature value with its unit symbol. Key properties: value (required, numeric temperature), unit (C/F, default C), size (sm/md/lg/xl, default lg), color (CSS color).",
          "properties": {
            "component": {
              "const": "TemperatureDisplay"
            },
            "value": {
              "$ref": "./common/common_types.json#/$defs/DynamicNumber",
              "description": "Temperature value"
            },
            "unit": {
              "type": "string",
              "description": "Temperature unit",
              "enum": [
                "C",
                "F"
              ],
              "default": "C"
            },
            "size": {
              "type": "string",
              "description": "Display size",
              "enum": [
                "sm",
                "md",
                "lg",
                "xl"
              ],
              "default": "lg"
            },
            "color": {
              "$ref": "./common/common_types.json#/$defs/DynamicString",
              "description": "Text color"
            }
          },
          "required": [
            "component",
            "value"
          ]
        }
      ],
      "unevaluatedProperties": false
    },
    "WeatherIcon": {
      "type": "object",
      "allOf": [
        {
          "$ref": "./common/common_types.json#/$defs/ComponentCommon"
        },
        {
          "$ref": "#/$defs/CatalogComponentCommon"
        },
        {
          "type": "object",
          "description": "Displays a weather condition icon. Key properties: condition (required, e.g. sunny/cloudy/rainy/stormy/snowy/foggy/windy), size (sm/md/lg/xl, default md), animated (boolean, default false).",
          "properties": {
            "component": {
              "const": "WeatherIcon"
            },
            "condition": {
              "type": "string",
              "description": "Weather condition to display",
              "enum": [
                "sunny",
                "cloudy",
                "partly-cloudy",
                "rainy",
                "stormy",
                "snowy",
                "foggy",
                "windy"
              ]
            },
            "size": {
              "type": "string",
              "description": "Icon size",
              "enum": [
                "sm",
                "md",
                "lg",
                "xl"
              ],
              "default": "md"
            },
            "animated": {
              "$ref": "./common/common_types.json#/$defs/DynamicBoolean",
              "description": "Whether to use subtle animation",
              "default": false
            }
          },
          "required": [
            "component",
            "condition"
          ]
        }
      ],
      "unevaluatedProperties": false
    },
    "WindIndicator": {
      "type": "object",
      "allOf": [
        {
          "$ref": "./common/common_types.json#/$defs/ComponentCommon"
        },
        {
          "$ref": "#/$defs/CatalogComponentCommon"
        },